{"actor":"DIRECT-primary","artifact_refs":["docs/app-task-ledger.v2.json"],"automation_status":"not_run","causal_refs":["EVT-REMEDIATION-REVIEW-V3-002"],"event_kind":"stage-handoff","event_ref":"EVT-REMEDIATION-DEV-V3-002","origin":"native","run_ref":"RUN-GRAPH-WORKFLOW-V2","schema":"app-process-event.v1","stage":"app-dev","status":"implemented","trace_refs":["SPEC-GRAPH-WORKFLOW-V3"]}
