{
  "schema": "app-process-event.v1",
  "run_ref": "RUN-GRAPH-WORKFLOW-V2",
  "event_ref": "EVT-REMEDIATION-REVIEW-V3-001",
  "event_kind": "review",
  "stage": "app-dev",
  "status": "in_progress",
  "actor": "DIRECT-primary",
  "causal_refs": [
    "EVT-REMEDIATION-TASK-V3-001"
  ],
  "trace_refs": [
    "SPEC-GRAPH-WORKFLOW-V3"
  ],
  "artifact_refs": [],
  "origin": "native",
  "automation_status": "not_run"
}
