{"actor":"DIRECT-primary","artifact_refs":[".github/runner/test_app_graph_runtime.py",".github/runner/test_deploy_plugin_sentry.py"],"automation_status":"not_run","causal_refs":["EVT-REMEDIATION-TASK-V3-002"],"event_kind":"review","event_ref":"EVT-REMEDIATION-REVIEW-V3-002","origin":"native","run_ref":"RUN-GRAPH-WORKFLOW-V2","schema":"app-process-event.v1","stage":"app-dev","status":"in_progress","trace_refs":["SPEC-GRAPH-WORKFLOW-V3"]}
