{
  "schema": "app-process-event.v1",
  "run_ref": "RUN-GRAPH-WORKFLOW-V2",
  "event_ref": "EVT-TRACE-AUDIT-V3-001",
  "event_kind": "stage-handoff",
  "stage": "app-analyze",
  "status": "needs-plan",
  "actor": "DIRECT-primary",
  "causal_refs": [
    "EVT-DEV-V3-001"
  ],
  "trace_refs": [
    "SPEC-GRAPH-WORKFLOW-V3"
  ],
  "artifact_refs": [],
  "origin": "native",
  "automation_status": "not_run"
}
