{"actor":"DIRECT-primary","artifact_refs":["contracts/app-process-audit-result.v1.schema.json"],"automation_status":"not_run","causal_refs":["EVT-REMEDIATION-TASK-V3-003"],"event_kind":"review","event_ref":"EVT-REMEDIATION-REVIEW-V3-003","origin":"native","run_ref":"RUN-GRAPH-WORKFLOW-V2","schema":"app-process-event.v1","stage":"app-dev","status":"in_progress","trace_refs":["SPEC-GRAPH-WORKFLOW-V3"]}
